{
  "$schema": "../schemas/candidate-locator.schema.json",
  "manifestSha256": "45de62928bb51ca44f132d43e9b0c324b76654b35bf049eecbd096f04bab43a6",
  "preparedArtifact": {
    "artifactId": 9345820057,
    "digest": "sha256:180d8e96d0458009191825129879037da42c9cf2a78becb3fa5dcb038e99791b",
    "repository": "flighthq/flight-reference-images",
    "workflowRunId": 32195887090
  },
  "releaseTag": "oracle-38b2f8d9-0f18-49d9-8da0-f58cb7bf3855-c0756162049b",
  "requestId": "38b2f8d9-0f18-49d9-8da0-f58cb7bf3855",
  "schemaVersion": 1,
  "sourceArtifact": {
    "artifactId": 9341349629,
    "digest": "sha256:bacd8cbbcd035f11d0a9fb5a36a35b6d02c62093bd4eaca3d11c16f5561a1e64",
    "repository": "flighthq/flight",
    "workflowRunId": 32181317235
  }
}
