{
  "$schema": "../schemas/candidate-locator.schema.json",
  "manifestSha256": "3afd9b68d87320c7485156db7ed4e273d8c5c0328ec8cdf9dbfc6f2d3cb4c505",
  "preparedArtifact": {
    "artifactId": 9346850773,
    "digest": "sha256:4cd12ece040cfa3225e00cb8293f098a63b7d495085e5a198671c620fcf9e113",
    "repository": "flighthq/flight-reference-images",
    "workflowRunId": 32199077527
  },
  "releaseTag": "oracle-e4fce4c0-e5a7-45d0-b8e7-21df064a058d-b49091d591ec",
  "requestId": "e4fce4c0-e5a7-45d0-b8e7-21df064a058d",
  "schemaVersion": 1,
  "sourceArtifact": {
    "artifactId": 9346152525,
    "digest": "sha256:550f2523381569595991c0c6af9a6a750c0b01b478c18bd54bceff9c7980fac6",
    "repository": "flighthq/flight",
    "workflowRunId": 32196779424
  }
}
